{
  "id": "equipment.weapon.battleaxe",
  "active": true,
  "count": 1,
  "cardType": "equipment",
  "name": "Battleaxe",
  "revision": 1,
  "moduleId": "core-alpha",
  "artId": "art.default-card",
  "printTemplate": "equipment-weapon-standard",
  "tags": [
    "equipment",
    "weapon",
    "melee",
    "axe",
    "battleaxe",
    "two-handed",
    "physical",
    "common"
  ],
  "rulesText": "Weapon\nMelee • Axe • Battleaxe\n3 Physical Damage\nRequires Axe proficiency.\nHands Required: 2 Hands.",
  "data": {
    "equipmentType": "weapon",
    "equipmentSlot": "weapon",
    "rangeTag": "melee",
    "weaponTags": [
      "axe",
      "battleaxe"
    ],
    "handsRequired": 2,
    "requiredProficiency": [
      "axe"
    ],
    "damage": {
      "amount": 3,
      "damageType": "physical"
    },
    "traits": [],
    "economy": {
      "equipmentPowerRating": 9,
      "valueGold": 90,
      "sellValueGold": 45,
      "rarity": "common"
    }
  },
  "source": {
    "sourceFile": "Cards/item_and_equipment_cards/equipment.md",
    "sourceSection": "Weapon Cards > Battleaxe",
    "verifiedAgainstRulebook": false,
    "notes": "Starter weapon catalog entry. Weapon tags support range and subtype eligibility checks."
  }
}
