{
  "id": "equipment.weapon.utility-dagger",
  "active": true,
  "count": 6,
  "cardType": "equipment",
  "name": "Utility Dagger",
  "revision": 1,
  "moduleId": "core-alpha",
  "artId": "art.default-card",
  "printTemplate": "equipment-weapon-standard",
  "tags": [
    "equipment",
    "weapon",
    "melee",
    "blade",
    "dagger",
    "one-handed",
    "physical",
    "common"
  ],
  "rulesText": "Weapon\nMelee • Blade • Dagger\n1 Physical Damage\nRequires Blade proficiency.\nHands Required: 1 Hand.",
  "data": {
    "equipmentType": "weapon",
    "equipmentSlot": "weapon",
    "rangeTag": "melee",
    "weaponTags": [
      "blade",
      "dagger"
    ],
    "handsRequired": 1,
    "requiredProficiency": [
      "blade"
    ],
    "damage": {
      "amount": 1,
      "damageType": "physical"
    },
    "traits": [],
    "economy": {
      "equipmentPowerRating": 2,
      "valueGold": 20,
      "sellValueGold": 10,
      "rarity": "common"
    }
  },
  "source": {
    "sourceFile": "Cards/item_and_equipment_cards/equipment.md",
    "sourceSection": "Weapon Cards > Utility Dagger",
    "verifiedAgainstRulebook": false,
    "notes": "Starter weapon catalog entry. Weapon tags support range and subtype eligibility checks."
  }
}
