{
  "id": "enemy.goblin-slinger",
  "active": true,
  "count": 3,
  "cardType": "enemy",
  "name": "Goblin Slinger",
  "revision": 1,
  "moduleId": "core-alpha",
  "artId": "art.default-card",
  "printTemplate": "enemy-standard",
  "tags": [
    "enemy",
    "goblin",
    "tier-1",
    "ranged",
    "physical",
    "goblin-warrens"
  ],
  "rulesText": "Sling Stone\nDeal 1 physical damage, ranged.\n\nLoot: 1 Coin.",
  "data": {
    "enemyTier": 1,
    "preferredRow": "enemyBack",
    "stats": {
      "hp": 2,
      "defense": 0
    },
    "actions": [
      {
        "id": "sling-stone",
        "name": "Sling Stone",
        "priority": 1,
        "actionType": "attack",
        "range": "ranged",
        "targeting": {
          "mode": "defaultHighestHeatLegalFriendlyEntity"
        },
        "damage": {
          "amount": 1,
          "damageType": "physical"
        }
      }
    ],
    "loot": [
      {
        "type": "currency",
        "amount": 1
      }
    ]
  },
  "source": {
    "sourceFile": "Cards/dungeon_cards/goblin enemies.txt",
    "sourceSection": "Tier 1 Goblins > Goblin Slinger",
    "verifiedAgainstRulebook": false,
    "notes": "Goblin Warrens playtest enemy. Count 3 represents three deck instances; this file is the single shared definition."
  }
}
