{
  "id": "dungeon.goblin-warrens.goblin-watchpost",
  "active": true,
  "count": 1,
  "cardType": "dungeonCard",
  "name": "Goblin Watchpost",
  "revision": 1,
  "moduleId": "core-alpha",
  "artId": "art.default-card",
  "printTemplate": "dungeon-trap-standard",
  "tags": [
    "dungeon-card",
    "area"
    
  ],
  "rulesText": "Area\n\n While this area card is in play, a barricade protects the back line enemies. In order to attack the back line forces, the barricade must be destroyed first. The barricade has 4 HP. ",
  "data": {
    "dungeonCardType": "earea",
    "dungeonThemes": [
      "goblin-warrens",
      "goblin-shadowy-coridor"
    ],
    "resolutionTiming": "immediatelyWhenDrawn",
    "responseOption": {
      "optional": false,
      "name": "Disarm Tripwire",
      "eligibleEntity": {
        "entityTypes": [
          "playerCharacter"
        ],
        "mustBePlayerControlled": true,
        "mustBeInSameRowAs": "activeCharacter",
        "requiresEquippedSkillTag": "rogue"
      },
      "onUse": {
        "type": "moveCard",
        "destination": "dungeonDiscardPile"
      }
    },
    "otherwise": {
      "target": "activeCharacter",
      "effects": [
        {
          "type": "dealDamage",
          "amount": 1,
          "damageType": "physical"
        },
        {
          "type": "gainHeat",
          "amount": 2
        }
      ]
    },
    "afterResolution": {
      "type": "moveCard",
      "destination": "dungeonDiscardPile"
    }
  },
  "source": {
    "sourceFile": "Cards/dungeon_cards/dungeonDecks.txt",
    "sourceSection": "Goblin Warrens / Scrap Fortress > Tripwire",
    "verifiedAgainstRulebook": false,
    "notes": "Rules text migrated from the current Goblin Warrens dungeon-card source. Count 2 is a provisional first-playtest deck-density decision and can be tuned after initial dungeon runs."
  }
}