{
  "id": "equipment.hands.weapon-grip-gloves",
  "active": true,
  "count": 1,
  "cardType": "equipment",
  "name": "Weapon Grip Gloves",
  "revision": 1,
  "moduleId": "core-alpha",
  "artId": "art.default-card",
  "printTemplate": "equipment-hands-standard",
  "tags": [
    "equipment",
    "hands",
    "clothing",
    "gloves",
    "common"
  ],
  "rulesText": "Handwear\nClothing • Gloves\nWeapon Grip: Once per combat, when you make a melee weapon attack, add +1 Physical Damage.",
  "data": {
    "equipmentType": "hands",
    "equipmentSlot": "hands",
    "category": "clothing",
    "accessoryTags": [
      "gloves"
    ],
    "defenseBonus": 0,
    "requiredProficiency": [],
    "traits": [
      "Weapon Grip: Once per combat, when you make a melee weapon attack, add +1 Physical Damage."
    ],
    "economy": {
      "equipmentPowerRating": 2,
      "valueGold": 20,
      "sellValueGold": 10,
      "rarity": "common"
    }
  },
  "source": {
    "sourceFile": "Cards/item_and_equipment_cards/equipment.md",
    "sourceSection": "Handwear Equipment Cards > Weapon Grip Gloves",
    "verifiedAgainstRulebook": false,
    "notes": "The once-per-combat trait should use the established equipment-use tracking method."
  }
}
